-- DML lifecycle frame coverage.
DROP EXTENSION IF EXISTS pg_iceberg_am CASCADE;
CREATE EXTENSION IF NOT EXISTS pg_iceberg_am;
CREATE SCHEMA dml_lifecycle;
-- INSERT ... SELECT ... RETURNING must not finalize on non-null slots.
CREATE TABLE dml_lifecycle.returning_t (
    id integer,
    label text
) USING iceberg;
INSERT INTO dml_lifecycle.returning_t
SELECT g, 'returning_' || g
FROM generate_series(1, 3) AS g
RETURNING id, label;
 id |    label    
----+-------------
  1 | returning_1
  2 | returning_2
  3 | returning_3
(3 rows)

SELECT count(*) AS rows_after_returning FROM dml_lifecycle.returning_t;
 rows_after_returning 
----------------------
                    3
(1 row)

-- Data-modifying CTEs are exposed through es_auxmodifytables.
CREATE TABLE dml_lifecycle.cte_t (
    id integer,
    label text
) USING iceberg;
WITH inserted AS (
    INSERT INTO dml_lifecycle.cte_t
    SELECT g, 'cte_' || g
    FROM generate_series(10, 12) AS g
    RETURNING id
)
SELECT count(*) AS returned_rows, min(id) AS min_id, max(id) AS max_id
FROM inserted;
 returned_rows | min_id | max_id 
---------------+--------+--------
             3 |     10 |     12
(1 row)

SELECT * FROM dml_lifecycle.cte_t ORDER BY id;
 id | label  
----+--------
 10 | cte_10
 11 | cte_11
 12 | cte_12
(3 rows)

-- ROLLBACK TO SAVEPOINT must abort the frame and allow a new frame later.
CREATE TABLE dml_lifecycle.savepoint_t (
    id integer
) USING iceberg;
BEGIN;
SAVEPOINT s1;
INSERT INTO dml_lifecycle.savepoint_t VALUES (1);
ROLLBACK TO SAVEPOINT s1;
INSERT INTO dml_lifecycle.savepoint_t VALUES (2);
COMMIT;
SELECT * FROM dml_lifecycle.savepoint_t ORDER BY id;
 id 
----
  2
(1 row)

-- RELEASE SAVEPOINT smoke test. This DML frame finishes before RELEASE, so
-- it does not directly exercise ResourceOwner reparent; it guards against
-- accidental leak warnings on the release path.
BEGIN;
SAVEPOINT s2;
INSERT INTO dml_lifecycle.savepoint_t VALUES (3);
RELEASE SAVEPOINT s2;
COMMIT;
SELECT * FROM dml_lifecycle.savepoint_t ORDER BY id;
 id 
----
  2
  3
(2 rows)

-- Nested subtransaction abort must only discard the inner frame.
BEGIN;
SAVEPOINT outer_sp;
INSERT INTO dml_lifecycle.savepoint_t VALUES (10);
SAVEPOINT inner_sp;
INSERT INTO dml_lifecycle.savepoint_t VALUES (11);
ROLLBACK TO SAVEPOINT inner_sp;
INSERT INTO dml_lifecycle.savepoint_t VALUES (12);
COMMIT;
SELECT * FROM dml_lifecycle.savepoint_t WHERE id >= 10 ORDER BY id;
 id 
----
 10
 12
(2 rows)

-- COPY FROM failure must abort the COPY frame and leave no inserted rows.
CREATE TABLE dml_lifecycle.copy_t (
    id integer
) USING iceberg;
\set VERBOSITY terse
COPY dml_lifecycle.copy_t FROM stdin;
ERROR:  invalid input syntax for type integer: "bad"
\set VERBOSITY default
SELECT 'no resource leak' AS check;
      check       
------------------
 no resource leak
(1 row)

SELECT count(*) AS rows_after_failed_copy FROM dml_lifecycle.copy_t;
 rows_after_failed_copy 
------------------------
                      0
(1 row)

COPY dml_lifecycle.copy_t FROM stdin;
SELECT * FROM dml_lifecycle.copy_t ORDER BY id;
 id 
----
  2
  3
(2 rows)

-- COPY into a partitioned table must use one frame with multiple relation
-- sessions and finalize all touched partitions.
CREATE TABLE dml_lifecycle.part_t (
    id integer
) PARTITION BY RANGE (id) USING iceberg;
CREATE TABLE dml_lifecycle.part_t_a
PARTITION OF dml_lifecycle.part_t
FOR VALUES FROM (0) TO (100) USING iceberg;
CREATE TABLE dml_lifecycle.part_t_b
PARTITION OF dml_lifecycle.part_t
FOR VALUES FROM (100) TO (200) USING iceberg;
COPY dml_lifecycle.part_t FROM stdin;
SELECT * FROM dml_lifecycle.part_t ORDER BY id;
 id  
-----
  10
  20
 150
(3 rows)

-- INSERT into a partitioned table must also use one ModifyTable frame with
-- multiple relation sessions.
INSERT INTO dml_lifecycle.part_t VALUES (30), (170), (40);
SELECT * FROM dml_lifecycle.part_t ORDER BY id;
 id  
-----
  10
  20
  30
  40
 150
 170
(6 rows)

-- MERGE insert-only still runs as CMD_MERGE and must finalize once at the
-- ModifyTable frame boundary.
CREATE TABLE dml_lifecycle.merge_insert_t (
    id integer,
    label text
) USING iceberg;
MERGE INTO dml_lifecycle.merge_insert_t AS target
USING (VALUES (21, 'merge_21'), (22, 'merge_22')) AS source(id, label)
ON target.id = source.id
WHEN NOT MATCHED THEN
    INSERT (id, label) VALUES (source.id, source.label);
SELECT * FROM dml_lifecycle.merge_insert_t ORDER BY id;
 id |  label   
----+----------
 21 | merge_21
 22 | merge_22
(2 rows)

-- Matched MERGE branches currently reach AM update/delete/lock paths that
-- IcebergModify does not implement yet, but they must fail as unsupported
-- features rather than corrupting the frame stack.
CREATE TABLE dml_lifecycle.merge_update_t (
    id integer,
    label text
) USING iceberg;
INSERT INTO dml_lifecycle.merge_update_t VALUES (31, 'old_31');
\set VERBOSITY sqlstate
MERGE INTO dml_lifecycle.merge_update_t AS target
USING (VALUES (31, 'new_31')) AS source(id, label)
ON target.id = source.id
WHEN MATCHED THEN
    UPDATE SET label = source.label;
ERROR:  0A000
\set VERBOSITY default
SELECT 'merge update unsupported cleaned up' AS check;
                check                
-------------------------------------
 merge update unsupported cleaned up
(1 row)

SELECT * FROM dml_lifecycle.merge_update_t ORDER BY id;
 id | label  
----+--------
 31 | old_31
(1 row)

INSERT INTO dml_lifecycle.merge_update_t VALUES (32, 'after_failed_merge');
SELECT * FROM dml_lifecycle.merge_update_t ORDER BY id;
 id |       label        
----+--------------------
 31 | old_31
 32 | after_failed_merge
(2 rows)

CREATE TABLE dml_lifecycle.merge_delete_t (
    id integer,
    label text
) USING iceberg;
INSERT INTO dml_lifecycle.merge_delete_t VALUES (41, 'old_41');
\set VERBOSITY sqlstate
MERGE INTO dml_lifecycle.merge_delete_t AS target
USING (VALUES (41)) AS source(id)
ON target.id = source.id
WHEN MATCHED THEN
    DELETE;
ERROR:  0A000
\set VERBOSITY default
SELECT 'merge delete unsupported cleaned up' AS check;
                check                
-------------------------------------
 merge delete unsupported cleaned up
(1 row)

SELECT * FROM dml_lifecycle.merge_delete_t ORDER BY id;
 id | label  
----+--------
 41 | old_41
(1 row)

INSERT INTO dml_lifecycle.merge_delete_t VALUES (42, 'after_failed_merge');
SELECT * FROM dml_lifecycle.merge_delete_t ORDER BY id;
 id |       label        
----+--------------------
 41 | old_41
 42 | after_failed_merge
(2 rows)

-- Trigger/SPI nested DML must use a nested frame and restore the outer frame.
CREATE TABLE dml_lifecycle.trigger_src (
    id integer
) USING iceberg;
CREATE TABLE dml_lifecycle.trigger_audit (
    id integer,
    note text
) USING iceberg;
CREATE FUNCTION dml_lifecycle.audit_insert()
RETURNS trigger
LANGUAGE plpgsql
AS $$
BEGIN
    INSERT INTO dml_lifecycle.trigger_audit VALUES (NEW.id, 'inserted');
    RETURN NEW;
END;
$$;
CREATE TRIGGER trigger_src_bi
BEFORE INSERT ON dml_lifecycle.trigger_src
FOR EACH ROW
EXECUTE FUNCTION dml_lifecycle.audit_insert();
INSERT INTO dml_lifecycle.trigger_src VALUES (7), (8);
SELECT * FROM dml_lifecycle.trigger_src ORDER BY id;
 id 
----
  7
  8
(2 rows)

SELECT * FROM dml_lifecycle.trigger_audit ORDER BY id;
 id |   note   
----+----------
  7 | inserted
  8 | inserted
(2 rows)

-- CTAS currently bypasses managed ModifyTable/COPY frames and must fail loudly.
\set VERBOSITY sqlstate
CREATE TABLE dml_lifecycle.ctas_t USING iceberg AS
SELECT 1::integer AS id;
ERROR:  0A000
\set VERBOSITY default
-- The unsupported CTAS path must not leave backend-local DML state poisoned.
CREATE TABLE dml_lifecycle.after_ctas_t (
    id integer
) USING iceberg;
INSERT INTO dml_lifecycle.after_ctas_t VALUES (99);
SELECT * FROM dml_lifecycle.after_ctas_t ORDER BY id;
 id 
----
 99
(1 row)

SET client_min_messages = warning;
DROP SCHEMA dml_lifecycle CASCADE;
RESET client_min_messages;
