-- Writable Iceberg FDW lifecycle against the shared REST/MinIO fixture.
\set ECHO none
-- Explicit CREATE FOREIGN TABLE validates the complete remote schema before
-- PostgreSQL creates the local relation.
CREATE FOREIGN TABLE iceberg_fdw_regress.writable (
    id integer,
    payload text
)
SERVER iceberg_rest
OPTIONS (
    catalog_name 'regress',
    catalog_namespace 'fdw_regress',
    catalog_table_name 'writable',
    mode 'read_write'
);
SELECT * FROM iceberg_fdw_regress.writable ORDER BY id;
 id | payload 
----+---------
  1 | one
  2 | two
  3 | three
(3 rows)

-- The provisioned format-v3 table already contains Spark deletion vectors.
-- Exercise FDW reads of that state, then create FDW deletion vectors through
-- UPDATE/DELETE while preserving read-own-writes semantics.
CREATE FOREIGN TABLE iceberg_fdw_regress.v3_mutations (
    id integer,
    payload text
)
SERVER iceberg_rest
OPTIONS (
    catalog_name 'regress',
    catalog_namespace 'fdw_regress',
    catalog_table_name 'v3_mutations',
    mode 'read_write'
);
SELECT * FROM iceberg_fdw_regress.v3_mutations ORDER BY id;
 id |   payload   
----+-------------
  1 | one
  3 | three-spark
  4 | four
(3 rows)

BEGIN;
INSERT INTO iceberg_fdw_regress.v3_mutations VALUES (5, 'five');
UPDATE iceberg_fdw_regress.v3_mutations
SET payload = 'one-pg' WHERE id = 1
RETURNING id, payload;
 id | payload 
----+---------
  1 | one-pg
(1 row)

DELETE FROM iceberg_fdw_regress.v3_mutations
WHERE id = 4
RETURNING id, payload;
 id | payload 
----+---------
  4 | four
(1 row)

SELECT * FROM iceberg_fdw_regress.v3_mutations ORDER BY id;
 id |   payload   
----+-------------
  1 | one-pg
  3 | three-spark
  5 | five
(3 rows)

COMMIT;
SELECT * FROM iceberg_fdw_regress.v3_mutations ORDER BY id;
 id |   payload   
----+-------------
  1 | one-pg
  3 | three-spark
  5 | five
(3 rows)

-- An empty local column list is populated from the remote Iceberg schema.
CREATE FOREIGN TABLE iceberg_fdw_regress.inferred ()
SERVER iceberg_rest
OPTIONS (
    catalog_name 'regress',
    catalog_namespace 'fdw_regress',
    catalog_table_name 'second',
    mode 'read_only'
);
SELECT * FROM iceberg_fdw_regress.inferred ORDER BY id;
 id | payload 
----+---------
 10 | ten
(1 row)

-- A catalog that does not vend storage access uses independently scoped
-- Iceberg-owned storage profiles; the REST server is not bound to one bucket.
CREATE FOREIGN TABLE iceberg_fdw_regress.fallback_writable (
    id integer,
    payload text
)
SERVER iceberg_rest_fallback
OPTIONS (
    catalog_name 'regress',
    catalog_namespace 'fdw_regress',
    catalog_table_name 'writable',
    mode 'read_write'
);
SELECT * FROM iceberg_fdw_regress.fallback_writable ORDER BY id;
 id  | payload  
-----+----------
 100 | fallback
(1 row)

CREATE FOREIGN TABLE iceberg_fdw_regress.fallback_second_bucket ()
SERVER iceberg_rest_fallback
OPTIONS (
    catalog_name 'regress',
    catalog_namespace 'fdw_regress',
    catalog_table_name 'second_bucket',
    mode 'read_only'
);
SELECT * FROM iceberg_fdw_regress.fallback_second_bucket ORDER BY id;
 id  |    payload    
-----+---------------
 200 | second-bucket
(1 row)

INSERT INTO iceberg_fdw_regress.fallback_writable
VALUES (101, 'client-fallback');
SELECT * FROM iceberg_fdw_regress.fallback_writable ORDER BY id;
 id  |     payload     
-----+-----------------
 100 | fallback
 101 | client-fallback
(2 rows)

CREATE SCHEMA iceberg_fdw_import;
IMPORT FOREIGN SCHEMA fdw_regress
LIMIT TO (second)
FROM SERVER iceberg_rest
INTO iceberg_fdw_import
OPTIONS (mode 'read_write');
INSERT INTO iceberg_fdw_import.second VALUES (15, 'fifteen');
SELECT array_agg(id ORDER BY id) AS imported_write_rows
FROM iceberg_fdw_import.second;
 imported_write_rows 
---------------------
 {10,15}
(1 row)

-- Mismatched explicit columns are rejected and leave no local catalog entry.
\set VERBOSITY terse
CREATE FOREIGN TABLE iceberg_fdw_regress.invalid_schema (
    id bigint,
    payload text
)
SERVER iceberg_rest
OPTIONS (
    catalog_name 'regress',
    catalog_namespace 'fdw_regress',
    catalog_table_name 'writable',
    mode 'read_write'
);
ERROR:  foreign table schema does not match the current Iceberg schema: column "id" has PostgreSQL type (oid 20, typmod -1) but Iceberg requires (oid 23, typmod -1)
SELECT to_regclass('iceberg_fdw_regress.invalid_schema') IS NULL
       AS invalid_schema_not_created;
 invalid_schema_not_created 
----------------------------
 t
(1 row)

INSERT INTO iceberg_fdw_regress.inferred VALUES (11, 'eleven');
ERROR:  FDW provider "iceberg_fdw" callback PlanForeignModify failed: foreign provider does not support this modify operation
ALTER FOREIGN TABLE iceberg_fdw_regress.writable ADD COLUMN extra integer;
ERROR:  Iceberg foreign tables do not support ALTER FOREIGN TABLE
ALTER FOREIGN TABLE iceberg_fdw_regress.writable RENAME TO renamed;
ERROR:  Iceberg foreign tables do not support RENAME on an Iceberg foreign table
TRUNCATE iceberg_fdw_regress.writable;
ERROR:  cannot truncate foreign table "writable"
VACUUM iceberg_fdw_regress.writable;
ERROR:  Iceberg foreign tables do not support VACUUM on an Iceberg foreign table
VACUUM (ANALYZE) iceberg_fdw_regress.writable;
ERROR:  Iceberg foreign tables do not support VACUUM on an Iceberg foreign table
\set VERBOSITY default
-- INSERT/UPDATE/DELETE are visible to later statements in the same PostgreSQL
-- transaction, and savepoint rollback removes only its own staged actions.
BEGIN;
INSERT INTO iceberg_fdw_regress.writable VALUES (4, 'four');
SELECT array_agg(id ORDER BY id) AS ids_after_insert
FROM iceberg_fdw_regress.writable;
 ids_after_insert 
------------------
 {1,2,3,4}
(1 row)

UPDATE iceberg_fdw_regress.writable
SET payload = 'two-updated'
WHERE id = 2
RETURNING id, payload;
 id |   payload   
----+-------------
  2 | two-updated
(1 row)

SELECT payload AS payload_after_update
FROM iceberg_fdw_regress.writable WHERE id = 2;
 payload_after_update 
----------------------
 two-updated
(1 row)

SAVEPOINT delete_three;
DELETE FROM iceberg_fdw_regress.writable
WHERE id = 3
RETURNING id, payload;
 id | payload 
----+---------
  3 | three
(1 row)

SELECT array_agg(id ORDER BY id) AS ids_after_delete
FROM iceberg_fdw_regress.writable;
 ids_after_delete 
------------------
 {1,2,4}
(1 row)

ROLLBACK TO SAVEPOINT delete_three;
SELECT array_agg(id ORDER BY id) AS ids_after_savepoint_rollback
FROM iceberg_fdw_regress.writable;
 ids_after_savepoint_rollback 
------------------------------
 {1,2,3,4}
(1 row)

COMMIT;
SELECT * FROM iceberg_fdw_regress.writable ORDER BY id;
 id |   payload   
----+-------------
  1 | one
  2 | two-updated
  3 | three
  4 | four
(4 rows)

COPY iceberg_fdw_regress.writable FROM stdin WITH (FORMAT csv);
SELECT array_agg(id ORDER BY id) AS ids_after_copy
FROM iceberg_fdw_regress.writable;
 ids_after_copy 
----------------
 {1,2,3,4,5,6}
(1 row)

-- One PostgreSQL transaction publishes changes for multiple remote tables in
-- one REST transaction request.
CREATE FOREIGN TABLE iceberg_fdw_regress.second (
    id integer,
    payload text
)
SERVER iceberg_rest
OPTIONS (
    catalog_name 'regress',
    catalog_namespace 'fdw_regress',
    catalog_table_name 'second',
    mode 'read_write'
);
BEGIN;
INSERT INTO iceberg_fdw_regress.writable VALUES (7, 'seven');
INSERT INTO iceberg_fdw_regress.second VALUES (20, 'twenty');
COMMIT;
SELECT array_agg(id ORDER BY id) AS writable_after_multi_table_commit
FROM iceberg_fdw_regress.writable;
 writable_after_multi_table_commit 
-----------------------------------
 {1,2,3,4,5,6,7}
(1 row)

SELECT array_agg(id ORDER BY id) AS second_after_multi_table_commit
FROM iceberg_fdw_regress.second;
 second_after_multi_table_commit 
---------------------------------
 {10,15,20}
(1 row)

-- Distinct immutable REST catalog bindings publish independently in one
-- PostgreSQL transaction.
CREATE FOREIGN TABLE iceberg_fdw_regress.second_server_table (
    id integer,
    payload text
)
SERVER iceberg_rest_second
OPTIONS (
    catalog_name 'regress',
    catalog_namespace 'fdw_regress',
    catalog_table_name 'second',
    mode 'read_write'
);
BEGIN;
INSERT INTO iceberg_fdw_regress.writable VALUES (30, 'thirty');
INSERT INTO iceberg_fdw_regress.second_server_table
VALUES (31, 'thirty-one');
COMMIT;
SELECT count(*) AS first_catalog_committed
FROM iceberg_fdw_regress.writable WHERE id = 30;
 first_catalog_committed 
-------------------------
                       1
(1 row)

SELECT count(*) AS second_catalog_committed
FROM iceberg_fdw_regress.second_server_table WHERE id = 31;
 second_catalog_committed 
--------------------------
                        1
(1 row)

-- Once a server/effective-user pair participates in a writable transaction,
-- changing its server configuration is rejected before another write or scan
-- can attach to the frozen transaction view.
\set VERBOSITY terse
BEGIN;
INSERT INTO iceberg_fdw_regress.writable VALUES (40, 'forty');
ALTER SERVER iceberg_rest OPTIONS (SET uri :'regress_failure_rest_uri');
INSERT INTO iceberg_fdw_regress.writable VALUES (41, 'forty-one');
ERROR:  FDW provider "iceberg_fdw" callback BeginForeignModify failed: FDW provider modify error: foreign server or user-mapping configuration changed after this writable transaction bound it
ROLLBACK;
\set VERBOSITY default
SELECT count(*) AS changed_binding_rows
FROM iceberg_fdw_regress.writable WHERE id IN (40, 41);
 changed_binding_rows 
----------------------
                    0
(1 row)

\set VERBOSITY terse
BEGIN;
INSERT INTO iceberg_fdw_regress.writable VALUES (50, 'fifty');
PREPARE TRANSACTION 'iceberg_fdw_must_not_prepare';
ERROR:  cannot PREPARE a transaction with staged writable Iceberg foreign-table changes
\set VERBOSITY default
SELECT count(*) AS unprepared_remote_rows
FROM iceberg_fdw_regress.writable WHERE id = 50;
 unprepared_remote_rows 
------------------------
                      0
(1 row)

-- Two real PostgreSQL backends update disjoint rows from the same Iceberg
-- snapshot. Serializable Iceberg validation rejects the stale committer.
SELECT dblink_connect(
    'iceberg_concurrent',
    format(
        'host=localhost port=%s dbname=%I',
        current_setting('port'),
        current_database()
    )
);
 dblink_connect 
----------------
 OK
(1 row)

SELECT dblink_exec('iceberg_concurrent', 'BEGIN');
 dblink_exec 
-------------
 BEGIN
(1 row)

SELECT dblink_exec(
    'iceberg_concurrent',
    $$UPDATE iceberg_fdw_regress.writable
      SET payload = 'backend-b' WHERE id = 1$$
);
 dblink_exec 
-------------
 UPDATE 1
(1 row)

BEGIN;
UPDATE iceberg_fdw_regress.writable
SET payload = 'backend-a' WHERE id = 2;
SELECT dblink_exec('iceberg_concurrent', 'COMMIT');
 dblink_exec 
-------------
 COMMIT
(1 row)

\set VERBOSITY terse
COMMIT;
ERROR:  iceberg error: DataConflict => row delta conflicts with data files added after scan snapshot: 1 conflicting data files
\set VERBOSITY default
SELECT id, payload FROM iceberg_fdw_regress.writable
WHERE id IN (1, 2) ORDER BY id;
 id |   payload   
----+-------------
  1 | backend-b
  2 | two-updated
(2 rows)

SELECT dblink_disconnect('iceberg_concurrent');
 dblink_disconnect 
-------------------
 OK
(1 row)

UPDATE iceberg_fdw_regress.writable SET payload = NULL WHERE id = 7;
ANALYZE iceberg_fdw_regress.writable;
SELECT reltuples::integer AS analyzed_live_rows
FROM pg_class
WHERE oid = 'iceberg_fdw_regress.writable'::regclass;
 analyzed_live_rows 
--------------------
                  8
(1 row)

SELECT null_frac = 0
       AND n_distinct = -1
       AND most_common_vals IS NULL
       AND histogram_bounds::text = '{1,2,3,4,5,6,7,30}'
       AS analyzed_id_statistics_complete
FROM pg_stats
WHERE schemaname = 'iceberg_fdw_regress'
  AND tablename = 'writable'
  AND attname = 'id';
 analyzed_id_statistics_complete 
---------------------------------
 t
(1 row)

SELECT abs(null_frac - 0.125) < 0.001
       AND abs(n_distinct + 0.875) < 0.001
       AND most_common_vals IS NULL
       AND histogram_bounds IS NOT NULL
       AS analyzed_payload_statistics_complete
FROM pg_stats
WHERE schemaname = 'iceberg_fdw_regress'
  AND tablename = 'writable'
  AND attname = 'payload';
 analyzed_payload_statistics_complete 
--------------------------------------
 t
(1 row)

-- DROP removes only PostgreSQL's local foreign-table metadata. Rebinding the
-- same remote identifier exposes the unchanged remote table and its data.
DROP FOREIGN TABLE iceberg_fdw_regress.writable;
SELECT to_regclass('iceberg_fdw_regress.writable') IS NULL
       AS local_definition_dropped;
 local_definition_dropped 
--------------------------
 t
(1 row)

CREATE FOREIGN TABLE iceberg_fdw_regress.rebound ()
SERVER iceberg_rest
OPTIONS (
    catalog_name 'regress',
    catalog_namespace 'fdw_regress',
    catalog_table_name 'writable',
    mode 'read_only'
);
SELECT array_agg(id ORDER BY id) AS remote_rows_survive_local_drop
FROM iceberg_fdw_regress.rebound;
 remote_rows_survive_local_drop 
--------------------------------
 {1,2,3,4,5,6,7,30}
(1 row)

-- The proxy forwards all reads and preparation requests but rejects only the
-- post-commit REST publication. PostgreSQL COMMIT therefore succeeds and emits
-- a warning; the uncommitted remote row is absent through the normal server.
CREATE FOREIGN TABLE iceberg_fdw_regress.failure_writable (
    id integer,
    payload text
)
SERVER iceberg_rest_failure
OPTIONS (
    catalog_name 'regress',
    catalog_namespace 'fdw_regress',
    catalog_table_name 'writable',
    mode 'read_write'
);
BEGIN;
INSERT INTO iceberg_fdw_regress.failure_writable VALUES (99, 'not-published');
COMMIT;
WARNING:  local transaction committed but Iceberg REST catalog publication for regress:fdw_regress.writable failed: Unexpected, context: { status: 503 Service Unavailable, type: CommitStateUnknown, code: 503 } => regression fixture rejected publication, source: REST catalog returned HTTP status 503 Service Unavailable; external table state is unknown
DETAIL:  pg-lakebase
SELECT count(*) AS unpublished_remote_rows
FROM iceberg_fdw_regress.rebound WHERE id = 99;
 unpublished_remote_rows 
-------------------------
                       0
(1 row)

SET client_min_messages = warning;
DROP SCHEMA iceberg_fdw_regress CASCADE;
DROP SCHEMA iceberg_fdw_import CASCADE;
DROP SERVER iceberg_rest CASCADE;
DROP SERVER iceberg_rest_failure CASCADE;
DROP SERVER iceberg_rest_second CASCADE;
DROP SERVER iceberg_rest_fallback CASCADE;
DROP SERVER bucket_a_storage CASCADE;
DROP SERVER bucket_b_storage CASCADE;
DROP EXTENSION dblink;
RESET client_min_messages;
