Parsed test spec with 4 sessions

starting permutation: s2_begin s2_delete s1_begin s1_insert s1_commit s2_commit verify
step s2_begin: BEGIN;
step s2_delete: DELETE FROM iceberg_cf.t WHERE id = 1;
step s1_begin: BEGIN;
step s1_insert: INSERT INTO iceberg_cf.t VALUES (200, 'new');
step s1_commit: COMMIT;
step s2_commit: COMMIT;
step verify: SELECT string_agg(id || ':' || label, ',' ORDER BY id, label) AS rows FROM iceberg_cf.t;
rows              
------------------
100:source,200:new
(1 row)


starting permutation: s2_begin s2_update s1_begin s1_insert s1_commit s2_commit verify
step s2_begin: BEGIN;
step s2_update: UPDATE iceberg_cf.t SET label = 's2' WHERE id = 1;
step s1_begin: BEGIN;
step s1_insert: INSERT INTO iceberg_cf.t VALUES (200, 'new');
step s1_commit: COMMIT;
step s2_commit: COMMIT;
step verify: SELECT string_agg(id || ':' || label, ',' ORDER BY id, label) AS rows FROM iceberg_cf.t;
rows                   
-----------------------
1:s2,100:source,200:new
(1 row)


starting permutation: s2_begin s2_delete s1_begin s1_update s1_commit s2_commit verify
step s2_begin: BEGIN;
step s2_delete: DELETE FROM iceberg_cf.t WHERE id = 1;
step s1_begin: BEGIN;
step s1_update: UPDATE iceberg_cf.t SET label = 's1' WHERE id = 100;
step s1_commit: COMMIT;
step s2_commit: COMMIT;
step verify: SELECT string_agg(id || ':' || label, ',' ORDER BY id, label) AS rows FROM iceberg_cf.t;
rows  
------
100:s1
(1 row)


starting permutation: s2_begin s2_update s1_begin s1_update s1_commit s2_commit verify
step s2_begin: BEGIN;
step s2_update: UPDATE iceberg_cf.t SET label = 's2' WHERE id = 1;
step s1_begin: BEGIN;
step s1_update: UPDATE iceberg_cf.t SET label = 's1' WHERE id = 100;
step s1_commit: COMMIT;
step s2_commit: COMMIT;
step verify: SELECT string_agg(id || ':' || label, ',' ORDER BY id, label) AS rows FROM iceberg_cf.t;
rows       
-----------
1:s2,100:s1
(1 row)


starting permutation: s2_begin s2_delete s1_begin s1_insert_overlap s1_commit s2_commit verify
step s2_begin: BEGIN;
step s2_delete: DELETE FROM iceberg_cf.t WHERE id = 1;
step s1_begin: BEGIN;
step s1_insert_overlap: INSERT INTO iceberg_cf.t VALUES (1, 'inserted');
step s1_commit: COMMIT;
step s2_commit: COMMIT;
ERROR:  iceberg error: DataConflict => row delta conflicts with data files added after scan snapshot: 1 conflicting data files
step verify: SELECT string_agg(id || ':' || label, ',' ORDER BY id, label) AS rows FROM iceberg_cf.t;
rows                        
----------------------------
1:base,1:inserted,100:source
(1 row)


starting permutation: s2_begin s2_del_abs s1_begin s1_insert s1_commit s2_commit verify
step s2_begin: BEGIN;
step s2_del_abs: DELETE FROM iceberg_cf.t WHERE abs(id) = 1;
step s1_begin: BEGIN;
step s1_insert: INSERT INTO iceberg_cf.t VALUES (200, 'new');
step s1_commit: COMMIT;
step s2_commit: COMMIT;
ERROR:  iceberg error: DataConflict => row delta conflicts with data files added after scan snapshot: 1 conflicting data files
step verify: SELECT string_agg(id || ':' || label, ',' ORDER BY id, label) AS rows FROM iceberg_cf.t;
rows                     
-------------------------
1:base,100:source,200:new
(1 row)


starting permutation: s2_begin s2_del_mixed_and s1_begin s1_insert s1_commit s2_commit verify
step s2_begin: BEGIN;
step s2_del_mixed_and: DELETE FROM iceberg_cf.t WHERE id = 1 AND abs(id) = 1;
step s1_begin: BEGIN;
step s1_insert: INSERT INTO iceberg_cf.t VALUES (200, 'new');
step s1_commit: COMMIT;
step s2_commit: COMMIT;
step verify: SELECT string_agg(id || ':' || label, ',' ORDER BY id, label) AS rows FROM iceberg_cf.t;
rows              
------------------
100:source,200:new
(1 row)


starting permutation: s2_begin s2_del_or s1_begin s1_insert s1_commit s2_commit verify
step s2_begin: BEGIN;
step s2_del_or: DELETE FROM iceberg_cf.t WHERE id = 1 OR abs(id) = 1;
step s1_begin: BEGIN;
step s1_insert: INSERT INTO iceberg_cf.t VALUES (200, 'new');
step s1_commit: COMMIT;
step s2_commit: COMMIT;
ERROR:  iceberg error: DataConflict => row delta conflicts with data files added after scan snapshot: 1 conflicting data files
step verify: SELECT string_agg(id || ':' || label, ',' ORDER BY id, label) AS rows FROM iceberg_cf.t;
rows                     
-------------------------
1:base,100:source,200:new
(1 row)


starting permutation: s2p_generic s2p_prepare s2p_begin s2p_delete s1_begin s1_insert s1_commit s2p_commit verify
step s2p_generic: SET plan_cache_mode = force_generic_plan;
step s2p_prepare: PREPARE delete_param(int) AS DELETE FROM iceberg_cf.t WHERE id = $1;
step s2p_begin: BEGIN;
step s2p_delete: EXECUTE delete_param(1);
step s1_begin: BEGIN;
step s1_insert: INSERT INTO iceberg_cf.t VALUES (200, 'new');
step s1_commit: COMMIT;
step s2p_commit: COMMIT;
ERROR:  iceberg error: DataConflict => row delta conflicts with data files added after scan snapshot: 1 conflicting data files
step verify: SELECT string_agg(id || ':' || label, ',' ORDER BY id, label) AS rows FROM iceberg_cf.t;
rows                     
-------------------------
1:base,100:source,200:new
(1 row)


starting permutation: s2_begin s2_update_self s1_begin s1_insert s1_commit s2_commit verify
step s2_begin: BEGIN;
step s2_update_self: UPDATE iceberg_cf.t AS target SET label = 's2' FROM iceberg_cf.t AS source WHERE target.id = 1 AND source.id = 100;
step s1_begin: BEGIN;
step s1_insert: INSERT INTO iceberg_cf.t VALUES (200, 'new');
step s1_commit: COMMIT;
step s2_commit: COMMIT;
step verify: SELECT string_agg(id || ':' || label, ',' ORDER BY id, label) AS rows FROM iceberg_cf.t;
rows                   
-----------------------
1:s2,100:source,200:new
(1 row)

