-- Trigger-visible row images and query-level TriggerRowStore behavior.
DROP EXTENSION IF EXISTS lagodb_iceberg CASCADE;
CREATE EXTENSION lagodb_iceberg;
-- Query-level TriggerRowStore ownership and routing.
CREATE SCHEMA dml_trigger_query_state;
SET pg_lakebase.customscan_mode = 'force';
CREATE TABLE dml_trigger_query_state.target (
    id integer,
    label text
) USING iceberg;
CREATE TABLE dml_trigger_query_state.audit (
    id integer,
    old_label text,
    new_label text
);
CREATE FUNCTION dml_trigger_query_state.audit_update()
RETURNS trigger
LANGUAGE plpgsql
AS $$
BEGIN
    INSERT INTO dml_trigger_query_state.audit
    VALUES (NEW.id, OLD.label, NEW.label);
    RETURN NULL;
END;
$$;
CREATE TRIGGER target_audit
AFTER UPDATE ON dml_trigger_query_state.target
FOR EACH ROW EXECUTE FUNCTION dml_trigger_query_state.audit_update();
INSERT INTO dml_trigger_query_state.target VALUES
    (1, 'old_1'), (2, 'old_2'), (3, 'old_3'), (4, 'old_4');
-- Sibling ModifyTable nodes for one relation must share one query-level store
-- without allowing OLD/NEW identities to cross between their result states.
COPY (
WITH first_update AS (
    UPDATE dml_trigger_query_state.target
    SET label = 'cte_1'
    WHERE id = 1
    RETURNING id
), second_update AS (
    UPDATE dml_trigger_query_state.target
    SET label = 'cte_2'
    WHERE id = 2
    RETURNING id
)
SELECT count(*)
FROM (
    SELECT id FROM first_update
    UNION ALL
    SELECT id FROM second_update
) AS changed
) TO STDOUT WITH (FORMAT csv);
2
COPY (
    SELECT id, old_label, new_label
    FROM dml_trigger_query_state.audit
    ORDER BY id
) TO STDOUT WITH (FORMAT csv);
1,old_1,cte_1
2,old_2,cte_2
TRUNCATE dml_trigger_query_state.audit;
-- The outer query store remains routable while an AFTER trigger runs a nested
-- SPI UPDATE that creates another query store for the same relation.
CREATE FUNCTION dml_trigger_query_state.nested_update()
RETURNS trigger
LANGUAGE plpgsql
AS $$
BEGIN
    IF NEW.id = 3 AND NEW.label = 'outer_3' THEN
        UPDATE dml_trigger_query_state.target
        SET label = 'nested_4'
        WHERE id = 4;
    END IF;
    RETURN NULL;
END;
$$;
CREATE TRIGGER target_nested
AFTER UPDATE ON dml_trigger_query_state.target
FOR EACH ROW EXECUTE FUNCTION dml_trigger_query_state.nested_update();
UPDATE dml_trigger_query_state.target SET label = 'outer_3' WHERE id = 3;
COPY (
    SELECT id, label
    FROM dml_trigger_query_state.target
    WHERE id IN (3, 4)
    ORDER BY id
) TO STDOUT WITH (FORMAT csv);
3,outer_3
4,nested_4
COPY (
    SELECT id, old_label, new_label
    FROM dml_trigger_query_state.audit
    ORDER BY id
) TO STDOUT WITH (FORMAT csv);
3,old_3,outer_3
4,old_4,nested_4
-- Disabled and WHEN=false events must not fire. A later matching row in the
-- same UPDATE verifies that the tuplestore can skip preserved, unused rows.
CREATE TABLE dml_trigger_query_state.conditional_target (
    id integer,
    label text
) USING iceberg;
CREATE TABLE dml_trigger_query_state.conditional_audit (
    trigger_name text,
    id integer,
    label text
);
CREATE FUNCTION dml_trigger_query_state.audit_conditional()
RETURNS trigger
LANGUAGE plpgsql
AS $$
BEGIN
    INSERT INTO dml_trigger_query_state.conditional_audit
    VALUES (TG_NAME, NEW.id, NEW.label);
    RETURN NULL;
END;
$$;
CREATE TRIGGER conditional_when
AFTER UPDATE ON dml_trigger_query_state.conditional_target
FOR EACH ROW WHEN (NEW.label = 'fire')
EXECUTE FUNCTION dml_trigger_query_state.audit_conditional();
CREATE TRIGGER conditional_disabled
AFTER UPDATE ON dml_trigger_query_state.conditional_target
FOR EACH ROW EXECUTE FUNCTION dml_trigger_query_state.audit_conditional();
ALTER TABLE dml_trigger_query_state.conditional_target
DISABLE TRIGGER conditional_disabled;
INSERT INTO dml_trigger_query_state.conditional_target VALUES
    (1, 'old_1'), (2, 'old_2');
UPDATE dml_trigger_query_state.conditional_target
SET label = CASE id WHEN 1 THEN 'skip' ELSE 'fire' END;
COPY (
    SELECT trigger_name, id, label
    FROM dml_trigger_query_state.conditional_audit
    ORDER BY trigger_name, id
) TO STDOUT WITH (FORMAT csv);
conditional_when,2,fire
-- work_mem is deliberately smaller than the retained OLD/NEW rows so the
-- PostgreSQL tuplestore must use its spill path.
SET work_mem = '64kB';
CREATE TABLE dml_trigger_query_state.spill_target (
    id integer,
    payload text
) USING iceberg;
CREATE TABLE dml_trigger_query_state.spill_audit (
    id integer,
    old_length integer,
    new_length integer
);
CREATE FUNCTION dml_trigger_query_state.audit_spill()
RETURNS trigger
LANGUAGE plpgsql
AS $$
BEGIN
    INSERT INTO dml_trigger_query_state.spill_audit
    VALUES (NEW.id, length(OLD.payload), length(NEW.payload));
    RETURN NULL;
END;
$$;
CREATE TRIGGER spill_audit
AFTER UPDATE ON dml_trigger_query_state.spill_target
FOR EACH ROW EXECUTE FUNCTION dml_trigger_query_state.audit_spill();
INSERT INTO dml_trigger_query_state.spill_target
SELECT id, repeat('x', 8192)
FROM generate_series(1, 80) AS id;
UPDATE dml_trigger_query_state.spill_target SET payload = payload || 'y';
COPY (
    SELECT count(*), min(old_length), max(new_length)
    FROM dml_trigger_query_state.spill_audit
) TO STDOUT WITH (FORMAT csv);
80,8192,8193
RESET work_mem;
-- AFTER-trigger materialization must be identical whether query CustomScan
-- optimization is forced or disabled; DML itself always uses CustomScan.
CREATE TABLE dml_trigger_query_state.force_target (
    id integer,
    label text
) USING iceberg;
CREATE TABLE dml_trigger_query_state.seq_target (
    id integer,
    label text
) USING iceberg;
CREATE TABLE dml_trigger_query_state.parity_audit (
    table_name text,
    old_label text,
    new_label text
);
CREATE FUNCTION dml_trigger_query_state.audit_parity()
RETURNS trigger
LANGUAGE plpgsql
AS $$
BEGIN
    INSERT INTO dml_trigger_query_state.parity_audit
    VALUES (TG_TABLE_NAME, OLD.label, NEW.label);
    RETURN NULL;
END;
$$;
CREATE TRIGGER force_audit
AFTER UPDATE ON dml_trigger_query_state.force_target
FOR EACH ROW EXECUTE FUNCTION dml_trigger_query_state.audit_parity();
CREATE TRIGGER seq_audit
AFTER UPDATE ON dml_trigger_query_state.seq_target
FOR EACH ROW EXECUTE FUNCTION dml_trigger_query_state.audit_parity();
INSERT INTO dml_trigger_query_state.force_target VALUES (1, 'old');
INSERT INTO dml_trigger_query_state.seq_target VALUES (1, 'old');
SET pg_lakebase.customscan_mode = 'force';
UPDATE dml_trigger_query_state.force_target SET label = 'new' WHERE id = 1;
SET pg_lakebase.customscan_mode = 'off';
UPDATE dml_trigger_query_state.seq_target SET label = 'new' WHERE id = 1;
COPY (
    SELECT old_label, new_label, count(*)
    FROM dml_trigger_query_state.parity_audit
    GROUP BY old_label, new_label
) TO STDOUT WITH (FORMAT csv);
old,new,2
RESET pg_lakebase.customscan_mode;
SET client_min_messages = warning;
DROP SCHEMA dml_trigger_query_state CASCADE;
RESET client_min_messages;
CREATE SCHEMA dml_lifecycle;
-- Trigger/SPI nested DML owns a nested Custom ModifyTable execution.
CREATE TABLE dml_lifecycle.trigger_src (
    id integer
) USING iceberg;
CREATE TABLE dml_lifecycle.trigger_audit (
    id integer,
    note text
) USING iceberg;
CREATE FUNCTION dml_lifecycle.audit_insert()
RETURNS trigger
LANGUAGE plpgsql
AS $$
BEGIN
    INSERT INTO dml_lifecycle.trigger_audit VALUES (NEW.id, 'inserted');
    RETURN NEW;
END;
$$;
CREATE TRIGGER trigger_src_bi
BEFORE INSERT ON dml_lifecycle.trigger_src
FOR EACH ROW
EXECUTE FUNCTION dml_lifecycle.audit_insert();
INSERT INTO dml_lifecycle.trigger_src VALUES (7), (8);
SELECT * FROM dml_lifecycle.trigger_src ORDER BY id;
 id 
----
  7
  8
(2 rows)

SELECT * FROM dml_lifecycle.trigger_audit ORDER BY id;
 id |   note   
----+----------
  7 | inserted
  8 | inserted
(2 rows)

-- OLD/NEW trigger slots and RETURNING must use PostgreSQL wholerow and the
-- final trigger-adjusted NEW row without a physical-row fetch.
CREATE TABLE dml_lifecycle.trigger_ud (
    id integer,
    label text
) USING iceberg;
CREATE TABLE dml_lifecycle.trigger_ud_audit (
    action text,
    id integer,
    old_label text,
    new_label text
) USING iceberg;
CREATE FUNCTION dml_lifecycle.audit_update_delete()
RETURNS trigger
LANGUAGE plpgsql
AS $$
BEGIN
    IF TG_OP = 'UPDATE' THEN
        INSERT INTO dml_lifecycle.trigger_ud_audit
        VALUES ('update', OLD.id, OLD.label, NEW.label);
        NEW.label := NEW.label || '_trigger';
        RETURN NEW;
    END IF;
    INSERT INTO dml_lifecycle.trigger_ud_audit
    VALUES ('delete', OLD.id, OLD.label, NULL);
    RETURN OLD;
END;
$$;
CREATE TRIGGER trigger_ud_bud
BEFORE UPDATE OR DELETE ON dml_lifecycle.trigger_ud
FOR EACH ROW
EXECUTE FUNCTION dml_lifecycle.audit_update_delete();
CREATE TABLE dml_lifecycle.trigger_ud_after_audit (
    action text,
    old_label text,
    new_label text
);
CREATE FUNCTION dml_lifecycle.audit_after_write()
RETURNS trigger
LANGUAGE plpgsql
AS $$
BEGIN
    IF TG_OP = 'INSERT' THEN
        INSERT INTO dml_lifecycle.trigger_ud_after_audit
        VALUES ('insert', NULL, NEW.label);
    ELSIF TG_OP = 'UPDATE' THEN
        INSERT INTO dml_lifecycle.trigger_ud_after_audit
        VALUES ('update', OLD.label, NEW.label);
    ELSE
        INSERT INTO dml_lifecycle.trigger_ud_after_audit
        VALUES ('delete', OLD.label, NULL);
    END IF;
    RETURN NULL;
END;
$$;
CREATE TRIGGER trigger_ud_aiud
AFTER INSERT OR UPDATE OR DELETE ON dml_lifecycle.trigger_ud
FOR EACH ROW
EXECUTE FUNCTION dml_lifecycle.audit_after_write();
INSERT INTO dml_lifecycle.trigger_ud VALUES (1, 'old');
UPDATE dml_lifecycle.trigger_ud
SET label = 'new'
WHERE id = 1
RETURNING id, label;
 id |    label    
----+-------------
  1 | new_trigger
(1 row)

DELETE FROM dml_lifecycle.trigger_ud
WHERE id = 1
RETURNING id, label;
 id |    label    
----+-------------
  1 | new_trigger
(1 row)

SELECT * FROM dml_lifecycle.trigger_ud_audit ORDER BY action;
 action | id |  old_label  | new_label 
--------+----+-------------+-----------
 delete |  1 | new_trigger | 
 update |  1 | old         | new
(2 rows)

SELECT * FROM dml_lifecycle.trigger_ud_after_audit ORDER BY action;
 action |  old_label  |  new_label  
--------+-------------+-------------
 delete | new_trigger | 
 insert |             | old
 update | old         | new_trigger
(3 rows)

-- PostgreSQL queues one event per AFTER trigger. The tuplestore adapter must
-- retain both OLD and NEW while multiple events reuse the same row pair.
CREATE TABLE dml_lifecycle.trigger_multi (
    id integer,
    label text
) USING iceberg;
CREATE TABLE dml_lifecycle.trigger_multi_audit (
    trigger_name text,
    old_label text,
    new_label text
);
CREATE FUNCTION dml_lifecycle.audit_multi()
RETURNS trigger
LANGUAGE plpgsql
AS $$
BEGIN
    INSERT INTO dml_lifecycle.trigger_multi_audit
    VALUES (TG_NAME, OLD.label, NEW.label);
    RETURN NULL;
END;
$$;
CREATE TRIGGER trigger_multi_a
AFTER UPDATE ON dml_lifecycle.trigger_multi
FOR EACH ROW
EXECUTE FUNCTION dml_lifecycle.audit_multi();
CREATE TRIGGER trigger_multi_b
AFTER UPDATE ON dml_lifecycle.trigger_multi
FOR EACH ROW
EXECUTE FUNCTION dml_lifecycle.audit_multi();
INSERT INTO dml_lifecycle.trigger_multi VALUES (1, 'old_1'), (2, 'old_2');
UPDATE dml_lifecycle.trigger_multi SET label = 'new_' || id;
SELECT * FROM dml_lifecycle.trigger_multi_audit
ORDER BY old_label, trigger_name;
  trigger_name   | old_label | new_label 
-----------------+-----------+-----------
 trigger_multi_a | old_1     | new_1
 trigger_multi_b | old_1     | new_1
 trigger_multi_a | old_2     | new_2
 trigger_multi_b | old_2     | new_2
(4 rows)

-- FDW-style query-local tuple storage cannot support deferred row events:
-- PostgreSQL destroys the tuplestore at query end. Reject that unsupported
-- lifetime explicitly instead of falling back to object-storage refetch.
CREATE CONSTRAINT TRIGGER trigger_multi_deferred
AFTER UPDATE ON dml_lifecycle.trigger_multi
DEFERRABLE INITIALLY DEFERRED
FOR EACH ROW
EXECUTE FUNCTION dml_lifecycle.audit_multi();
\set VERBOSITY sqlstate
UPDATE dml_lifecycle.trigger_multi SET label = 'deferred' WHERE id = 1;
ERROR:  0A000
\set VERBOSITY default
DROP TRIGGER trigger_multi_deferred ON dml_lifecycle.trigger_multi;
SET client_min_messages = warning;
DROP SCHEMA dml_lifecycle CASCADE;
RESET client_min_messages;
